{
  "$schema": "https://json-schema.org/draft/2020-12/schema",
  "$id": "https://github.com/uaipedro/trama/schema/document-v1.json",
  "title": "trama document",
  "description": "Grafo de computação do trama. Formato canônico e estável: pensado para ser escrito e editado à mão ou por um LLM. `ui` é apresentação pura e nunca afeta o resultado do cálculo.",
  "type": "object",
  "required": ["format", "nodes", "edges"],
  "properties": {
    "format": { "const": 1 },
    "rev": { "type": "integer", "minimum": 0, "description": "Revisão do documento; usada pelo protocolo de ops para detectar edição concorrente." },
    "collections": {
      "type": "object",
      "description": "Manifesto: coleções que este documento exige, e em que versão foram usadas.",
      "additionalProperties": { "type": "string" }
    },
    "nodes": {
      "type": "object",
      "description": "Chave = id de instância, imutável e sem significado. Nunca derivado de rótulo, posição ou ordem.",
      "propertyNames": { "pattern": "^[A-Za-z0-9_.-]+$" },
      "additionalProperties": {
        "type": "object",
        "required": ["type"],
        "properties": {
          "type": { "type": "string", "pattern": "^[a-z][a-z0-9_]*/[a-z_][a-z0-9_]*$" },
          "type_version": { "type": "integer", "minimum": 1 },
          "label": { "type": "string", "description": "Rótulo visível. Editável; não é identidade." },
          "params": { "type": "object" },
          "seed": { "type": "integer", "description": "Materializada na criação. Estável sob renome, cópia e agrupamento." }
        },
        "additionalProperties": false
      }
    },
    "edges": {
      "type": "array",
      "items": {
        "type": "object",
        "required": ["from", "to"],
        "properties": {
          "from": {
            "type": "object", "required": ["node", "port"],
            "properties": { "node": { "type": "string" }, "port": { "type": "string" } },
            "additionalProperties": false
          },
          "to": {
            "type": "object", "required": ["node", "port"],
            "properties": { "node": { "type": "string" }, "port": { "type": "string" } },
            "additionalProperties": false
          },
          "index": { "type": "integer", "minimum": 1, "description": "Ordena as entradas de uma porta variádica. Ignorado em porta comum." }
        },
        "additionalProperties": false
      }
    },
    "ui": {
      "type": "object",
      "description": "Apresentação pura. Nunca entra na chave de cache. `positions` é opcional: sem ela, o editor faz auto-layout — é o que permite escrever um documento à mão sem inventar coordenadas.",
      "properties": {
        "positions": {
          "type": "object",
          "additionalProperties": {
            "type": "array", "items": { "type": "number" }, "minItems": 2, "maxItems": 2
          }
        },
        "sizes": {
          "description": "Largura do card e altura do preview, em pixels. Ausente = talhe padrão.",
          "type": "object",
          "additionalProperties": {
            "type": "array", "items": { "type": "number" }, "minItems": 2, "maxItems": 2
          }
        },
        "views": {
          "description": "Id da vista escolhida por nó. Id, nunca índice: índice quebra em silêncio quando a coleção reordena as vistas. Vista ausente no renderer cai na primeira.",
          "type": "object",
          "additionalProperties": { "type": "string" }
        },
        "frames": {
          "description": "Frames: retângulos de apresentação, com título e ordem de slide. Chave = id do frame. O pertencimento de um card a um frame é GEOMÉTRICO (card inteiro dentro do retângulo) e nunca é gravado.",
          "type": "object",
          "additionalProperties": {
            "type": "object",
            "required": ["x", "y", "w", "h"],
            "properties": {
              "x": { "type": "number" },
              "y": { "type": "number" },
              "w": { "type": "number", "exclusiveMinimum": 0 },
              "h": { "type": "number", "exclusiveMinimum": 0 },
              "title": { "type": "string" },
              "aspect": { "type": "string", "description": "livre, 16:9, 4:3, 1:1 ou A4. Valor desconhecido é tratado como livre pelo editor." },
              "color": { "type": "string", "description": "Nome do tom (azul, verde, amarelo, laranja, rosa, roxo, cinza), nunca hex." },
              "order": { "type": "integer", "minimum": 1 }
            },
            "additionalProperties": false
          }
        },
        "notes": {
          "description": "Blocos de apresentação: markdown e imagem. Igual aos frames, são apresentação pura e nunca afetam o cálculo. Não têm porta nem execução. `src` é relativo à pasta `imagens/` do projeto, que é a única servida ao navegador.",
          "type": "object",
          "additionalProperties": {
            "type": "object",
            "required": ["x", "y", "w", "h", "kind"],
            "properties": {
              "x": { "type": "number" },
              "y": { "type": "number" },
              "w": { "type": "number", "exclusiveMinimum": 0 },
              "h": { "type": "number", "exclusiveMinimum": 0 },
              "kind": { "enum": ["markdown", "imagem"] },
              "text": { "type": "string", "description": "Markdown. Só em kind=markdown." },
              "escala": { "enum": ["letreiro", "nota"], "description": "Função do bloco no diagrama: letreiro sai grande e centralizado; nota, em tamanho de texto corrido." },
              "fundo": { "enum": ["nenhum", "cartao"] },
              "color": { "type": "string", "description": "Nome do tom (os mesmos do frame) ou 'nenhuma'. Nunca hex. Nome desconhecido é tratado como 'nenhuma' pelo editor." },
              "src": { "type": "string", "description": "Caminho relativo a `imagens/`, sem '..'. Só em kind=imagem." },
              "fit": { "enum": ["contain", "cover"] }
            },
            "additionalProperties": false
          }
        },
        "modes": {
          "description": "Modo de exibição por card. Ausente = completo. O editor oferece mini, completo e solto; params e preview só vêm de documento antigo e são lidos como completo (preview = params recolhidos).",
          "type": "object",
          "additionalProperties": { "enum": ["mini", "params", "preview", "completo", "solto"] }
        },
        "saidas": {
          "description": "Nomes visuais de saídas, por nó e porta. Não afetam a execução.",
          "type": "object",
          "additionalProperties": { "type": "object", "additionalProperties": { "type": "string" } }
        },
        "soltos": {
          "description": "Caixa do preview destacado de um card em modo solto: [x, y, w, h] em coordenadas do canvas.",
          "type": "object",
          "additionalProperties": {
            "type": "array", "items": { "type": "number" }, "minItems": 4, "maxItems": 4
          }
        },
        "galeria": {
          "description": "Marca de galeria por card: true entra, false sai. Ausente = regra do projeto (imagens entram sozinhas se `galeria.imagens` em trama.json).",
          "type": "object",
          "additionalProperties": { "type": "boolean" }
        },
        "ramos": {
          "description": "Ramos de bifurcação. `pares` mapeia card original -> cópia; o editor espelha params entre gêmeos, exceto no par de `origem` (a decisão que difere) e nas cópias em `desligados`.",
          "type": "object",
          "additionalProperties": {
            "type": "object",
            "required": ["letra", "origem", "pares"],
            "properties": {
              "letra": { "type": "string" },
              "origem": { "type": "string" },
              "pares": { "type": "object", "additionalProperties": { "type": "string" } },
              "desligados": { "type": "array", "items": { "type": "string" } }
            },
            "additionalProperties": false
          }
        },
        "folds": {
          "description": "Partes recolhidas/expandidas de cada card. Chave ausente = preview e params abertos, mini desligado.",
          "type": "object",
          "additionalProperties": {
            "type": "object",
            "properties": {
              "preview": { "type": "boolean" },
              "params": { "type": "boolean" },
              "mini": { "type": "boolean" }
            },
            "additionalProperties": false
          }
        }
      }
    }
  },
  "additionalProperties": false
}
