{
  "format": 1,
  "rev": 190,
  "collections": {
    "ml": "0.1.0",
    "data": "0.1.0",
    "view": "0.1.0"
  },
  "nodes": {
    "divisao": {
      "type": "ml/split",
      "type_version": 3,
      "label": "Separar treino / teste",
      "params": {
        "estratificar": true,
        "resposta": "HeartDisease"
      },
      "seed": 266292228
    },
    "cart": {
      "type": "ml/cart",
      "type_version": 4,
      "label": "CART · árvore de decisão",
      "params": {
        "tarefa": "classificacao",
        "resposta": "HeartDisease",
        "preditores": ""
      },
      "seed": 101876763
    },
    "cart_prever": {
      "type": "models/predict",
      "type_version": 1,
      "label": "Prever",
      "params": {},
      "seed": 117514221
    },
    "cart_avaliar": {
      "type": "models/evaluate",
      "type_version": 3,
      "label": "Avaliar previsões",
      "params": {
        "resposta": "HeartDisease"
      },
      "seed": 176672245
    },
    "figs": {
      "type": "ml/figs",
      "type_version": 3,
      "label": "FIGS · soma de árvores",
      "params": {
        "tarefa": "classificacao",
        "resposta": "HeartDisease",
        "preditores": ""
      },
      "seed": 133858971
    },
    "figs_prever": {
      "type": "models/predict",
      "type_version": 1,
      "label": "Prever",
      "params": {},
      "seed": 5659416
    },
    "figs_avaliar": {
      "type": "models/evaluate",
      "type_version": 3,
      "label": "Avaliar previsões",
      "params": {
        "resposta": "HeartDisease"
      },
      "seed": 105942658
    },
    "01M2RPCXVC0349CC": {
      "type": "data/read",
      "type_version": 1,
      "label": "Ler CSV",
      "params": {
        "path": "heart.csv",
        "formato": "csv"
      },
      "seed": 117261368
    },
    "01M2TC7PSZF96B49": {
      "type": "ml/tree_plot",
      "type_version": 2,
      "label": "Visualizar árvores",
      "params": {
        "tema": "claro"
      },
      "seed": 79618316
    },
    "01M2TC9D5V41DAAE": {
      "type": "ml/tree_plot",
      "type_version": 2,
      "label": "Visualizar árvores",
      "params": {
        "tema": "claro"
      },
      "seed": 17085427
    },
    "01M2TCB8RR1871B1": {
      "type": "models/importance",
      "type_version": 1,
      "label": "Importância de variáveis",
      "params": {},
      "seed": 97890486
    },
    "01M2TEP2RAC5C185": {
      "type": "view/bars",
      "type_version": 1,
      "label": "Barras",
      "params": {
        "x": "termo",
        "y": "importancia",
        "ordenar": true,
        "deitar": true,
        "tema": "claro",
        "titulo": "Importância das Variáveis"
      },
      "seed": 82994007
    }
  },
  "edges": [
    {
      "from": {
        "node": "divisao",
        "port": "treino"
      },
      "to": {
        "node": "cart",
        "port": "dados"
      },
      "index": 1
    },
    {
      "from": {
        "node": "cart",
        "port": "out"
      },
      "to": {
        "node": "cart_prever",
        "port": "modelo"
      },
      "index": 1
    },
    {
      "from": {
        "node": "divisao",
        "port": "teste"
      },
      "to": {
        "node": "cart_prever",
        "port": "dados"
      },
      "index": 1
    },
    {
      "from": {
        "node": "cart_prever",
        "port": "out"
      },
      "to": {
        "node": "cart_avaliar",
        "port": "dados"
      },
      "index": 1
    },
    {
      "from": {
        "node": "divisao",
        "port": "treino"
      },
      "to": {
        "node": "figs",
        "port": "dados"
      },
      "index": 1
    },
    {
      "from": {
        "node": "figs",
        "port": "out"
      },
      "to": {
        "node": "figs_prever",
        "port": "modelo"
      },
      "index": 1
    },
    {
      "from": {
        "node": "divisao",
        "port": "teste"
      },
      "to": {
        "node": "figs_prever",
        "port": "dados"
      },
      "index": 1
    },
    {
      "from": {
        "node": "figs_prever",
        "port": "out"
      },
      "to": {
        "node": "figs_avaliar",
        "port": "dados"
      },
      "index": 1
    },
    {
      "from": {
        "node": "figs",
        "port": "out"
      },
      "to": {
        "node": "01M2TC7PSZF96B49",
        "port": "modelo"
      },
      "index": 1
    },
    {
      "from": {
        "node": "cart",
        "port": "out"
      },
      "to": {
        "node": "01M2TC9D5V41DAAE",
        "port": "modelo"
      },
      "index": 1
    },
    {
      "from": {
        "node": "figs",
        "port": "out"
      },
      "to": {
        "node": "01M2TCB8RR1871B1",
        "port": "modelo"
      },
      "index": 1
    },
    {
      "from": {
        "node": "01M2RPCXVC0349CC",
        "port": "out"
      },
      "to": {
        "node": "divisao",
        "port": "dados"
      },
      "index": 1
    },
    {
      "from": {
        "node": "01M2TCB8RR1871B1",
        "port": "out"
      },
      "to": {
        "node": "01M2TEP2RAC5C185",
        "port": "dados"
      },
      "index": 1
    }
  ],
  "ui": {
    "positions": {
      "divisao": [117, 84],
      "cart": [448, 67],
      "cart_prever": [719, 82],
      "cart_avaliar": [1015, 77],
      "figs": [461, 515],
      "figs_prever": [1122, 566],
      "figs_avaliar": [1400, 557],
      "01M2RPCXVC0349CC": [-649, -6],
      "01M2TC7PSZF96B49": [1670, 602],
      "01M2TC9D5V41DAAE": [1313, 18],
      "01M2TCB8RR1871B1": [2338, 664],
      "01M2TEP2RAC5C185": [2752, 634]
    },
    "sizes": {
      "01M2RPCXVC0349CC": [640, 400],
      "01M2TC7PSZF96B49": [656, 320],
      "01M2TC9D5V41DAAE": [640, 368],
      "01M2TCB8RR1871B1": [288, 288],
      "figs": [624, 256]
    },
    "views": {
      "figs": "tabela"
    },
    "frames": {},
    "modes": {
      "01M2TC7PSZF96B49": "preview",
      "01M2TC9D5V41DAAE": "preview"
    },
    "notes": {},
    "soltos": {},
    "ocultos": {}
  }
}
