{
  "format": 1,
  "rev": 24,
  "collections": {
    "data": "0.1.0"
  },
  "nodes": {
    "ler": {
      "type": "data/read",
      "type_version": 1,
      "label": "Ler CSV",
      "params": {
        "path": "vendas.csv",
        "formato": "csv"
      },
      "seed": 19942611
    },
    "filtrar": {
      "type": "data/filter",
      "type_version": 2,
      "label": "Filtrar",
      "params": {
        "expr": "valor > 180"
      },
      "seed": 19942610
    },
    "total": {
      "type": "data/mutate",
      "type_version": 2,
      "label": "Criar coluna",
      "params": {
        "name": "receita",
        "expr": "valor * qtd"
      },
      "seed": 19942613
    },
    "porregiao": {
      "type": "data/group_summarise",
      "type_version": 1,
      "label": "Agrupar e resumir",
      "params": {
        "by": "regiao",
        "name": "receita_total",
        "expr": "sum(receita)"
      },
      "seed": 19942613
    },
    "porproduto": {
      "type": "data/group_summarise",
      "type_version": 1,
      "label": "Agrupar e resumir",
      "params": {
        "by": "produto",
        "name": "receita_total",
        "expr": "sum(receita)"
      },
      "seed": 19942609
    },
    "ranking": {
      "type": "data/arrange",
      "type_version": 1,
      "label": "Ordenar",
      "params": {
        "cols": "receita_total",
        "desc": true
      },
      "seed": 19942614
    }
  },
  "edges": [
    {
      "from": {
        "node": "ler",
        "port": "out"
      },
      "to": {
        "node": "filtrar",
        "port": "dados"
      },
      "index": 1
    },
    {
      "from": {
        "node": "filtrar",
        "port": "out"
      },
      "to": {
        "node": "total",
        "port": "dados"
      },
      "index": 1
    },
    {
      "from": {
        "node": "total",
        "port": "out"
      },
      "to": {
        "node": "porregiao",
        "port": "dados"
      },
      "index": 1
    },
    {
      "from": {
        "node": "total",
        "port": "out"
      },
      "to": {
        "node": "porproduto",
        "port": "dados"
      },
      "index": 1
    },
    {
      "from": {
        "node": "porregiao",
        "port": "out"
      },
      "to": {
        "node": "ranking",
        "port": "dados"
      },
      "index": 1
    }
  ],
  "ui": {
    "positions": {
      "ler": [40, 180],
      "filtrar": [330, 180],
      "total": [620, 180],
      "porregiao": [910, 80],
      "porproduto": [910, 300],
      "ranking": [1200, 80]
    },
    "sizes": {},
    "views": {},
    "frames": {},
    "notes": {},
    "modes": {},
    "soltos": {},
    "ocultos": {}
  }
}
