{
  "format": 1,
  "rev": 265,
  "collections": {
    "data": "0.1.0",
    "view": "0.1.0"
  },
  "nodes": {
    "01M2WWBTQ0ABEE33": {
      "type": "data/read",
      "type_version": 1,
      "label": "Ler JSON",
      "params": {
        "path": "spotify_2026.json",
        "formato": "json"
      },
      "seed": 92774657
    },
    "01M2WWD53X78939F": {
      "type": "data/summary",
      "type_version": 1,
      "label": "Resumo",
      "params": {},
      "seed": 115669239
    },
    "01M2WWFH9P424B71": {
      "type": "data/filter",
      "type_version": 2,
      "label": "Filtrar",
      "params": {
        "expr": "!is.na(episode_name)"
      },
      "seed": 103683943
    },
    "01M2WWJF9E26956F": {
      "type": "data/group_summarise",
      "type_version": 1,
      "label": "Agrupar e resumir",
      "params": {
        "expr": "dplyr::n_distinct(episode_show_name),\nsum(ms_played)/60000",
        "name": "unicos, tempo",
        "by": "episode_show_name"
      },
      "seed": 107843358
    },
    "01M2WWREGS496FCB": {
      "type": "data/arrange",
      "type_version": 1,
      "label": "Ordenar",
      "params": {
        "cols": "tempo",
        "desc": true
      },
      "seed": 188536589
    },
    "01M2WWS9C8EFD0A2": {
      "type": "data/slice_head",
      "type_version": 2,
      "label": "Primeiras N",
      "params": {
        "n": 5
      },
      "seed": 232924284
    },
    "01M2WWT07Z413425": {
      "type": "view/bars",
      "type_version": 1,
      "label": "Barras",
      "params": {
        "x": "episode_show_name",
        "y": "tempo",
        "ordenar": true,
        "deitar": true,
        "tema": "claro"
      },
      "seed": 195957935
    }
  },
  "edges": [
    {
      "from": {
        "node": "01M2WWBTQ0ABEE33",
        "port": "out"
      },
      "to": {
        "node": "01M2WWD53X78939F",
        "port": "dados"
      },
      "index": 1
    },
    {
      "from": {
        "node": "01M2WWBTQ0ABEE33",
        "port": "out"
      },
      "to": {
        "node": "01M2WWFH9P424B71",
        "port": "dados"
      },
      "index": 1
    },
    {
      "from": {
        "node": "01M2WWFH9P424B71",
        "port": "out"
      },
      "to": {
        "node": "01M2WWJF9E26956F",
        "port": "dados"
      },
      "index": 1
    },
    {
      "from": {
        "node": "01M2WWJF9E26956F",
        "port": "out"
      },
      "to": {
        "node": "01M2WWREGS496FCB",
        "port": "dados"
      },
      "index": 1
    },
    {
      "from": {
        "node": "01M2WWREGS496FCB",
        "port": "out"
      },
      "to": {
        "node": "01M2WWS9C8EFD0A2",
        "port": "dados"
      },
      "index": 1
    },
    {
      "from": {
        "node": "01M2WWS9C8EFD0A2",
        "port": "out"
      },
      "to": {
        "node": "01M2WWT07Z413425",
        "port": "dados"
      },
      "index": 1
    }
  ],
  "ui": {
    "positions": {
      "01M2WWBTQ0ABEE33": [0, 380],
      "01M2WWD53X78939F": [490, 0],
      "01M2WWFH9P424B71": [410, 581],
      "01M2WWJF9E26956F": [900, 576],
      "01M2WWREGS496FCB": [1390, 576],
      "01M2WWS9C8EFD0A2": [1896, 605],
      "01M2WWT07Z413425": [2450, 477]
    },
    "sizes": {
      "01M2WWBTQ0ABEE33": [320, 192],
      "01M2WWD53X78939F": [240, 448],
      "01M2WWFH9P424B71": [400, 272],
      "01M2WWJF9E26956F": [400, 256],
      "01M2WWREGS496FCB": [416, 304],
      "01M2WWS9C8EFD0A2": [464, 240],
      "01M2WWT07Z413425": [880, 528]
    },
    "views": {
      "01M2WWFH9P424B71": "resumo"
    },
    "frames": {
      "01M2WWX69A61BF35": {
        "x": -105,
        "y": -180,
        "w": 3495,
        "h": 1372,
        "title": "Frame 1",
        "aspect": "livre",
        "color": "azul",
        "order": 1
      }
    },
    "notes": {},
    "modes": {
      "01M2WWT07Z413425": "preview"
    },
    "soltos": {},
    "ocultos": {}
  }
}
