{
  "format": 1,
  "rev": 45,
  "collections": {
    "ml": "0.1.0"
  },
  "nodes": {
    "dados": {
      "type": "ml/example",
      "type_version": 1,
      "label": "Dados para aprender",
      "params": {
        "nome": "mtcars"
      },
      "seed": 67574363
    },
    "divisao": {
      "type": "ml/split",
      "type_version": 1,
      "label": "Separar treino / teste",
      "params": {
        "resposta": "mpg"
      },
      "seed": 63013732
    },
    "linear": {
      "type": "ml/linear",
      "type_version": 1,
      "label": "Linear / logística",
      "params": {
        "resposta": "mpg",
        "preditores": "wt, hp, disp"
      },
      "seed": 57671444
    },
    "linear_prever": {
      "type": "models/predict",
      "type_version": 1,
      "label": "Prever",
      "params": {},
      "seed": 50952665
    },
    "linear_avaliar": {
      "type": "models/evaluate",
      "type_version": 2,
      "label": "Avaliar previsões",
      "params": {
        "resposta": "mpg"
      },
      "seed": 29230160
    },
    "cart": {
      "type": "ml/cart",
      "type_version": 2,
      "label": "CART · árvore de decisão",
      "params": {
        "resposta": "mpg",
        "preditores": "wt, hp, disp"
      },
      "seed": 191072804
    },
    "cart_prever": {
      "type": "models/predict",
      "type_version": 1,
      "label": "Prever",
      "params": {},
      "seed": 214577655
    },
    "cart_avaliar": {
      "type": "models/evaluate",
      "type_version": 2,
      "label": "Avaliar previsões",
      "params": {
        "resposta": "mpg"
      },
      "seed": 249335127
    },
    "figs": {
      "type": "ml/figs",
      "type_version": 1,
      "label": "FIGS · soma de árvores",
      "params": {
        "resposta": "mpg",
        "preditores": "wt, hp, disp"
      },
      "seed": 173837064
    },
    "figs_prever": {
      "type": "models/predict",
      "type_version": 1,
      "label": "Prever",
      "params": {},
      "seed": 136549934
    },
    "figs_avaliar": {
      "type": "models/evaluate",
      "type_version": 2,
      "label": "Avaliar previsões",
      "params": {
        "resposta": "mpg"
      },
      "seed": 227974809
    },
    "forest": {
      "type": "ml/forest",
      "type_version": 1,
      "label": "Random forest",
      "params": {
        "resposta": "mpg",
        "preditores": "wt, hp, disp"
      },
      "seed": 171693836
    },
    "forest_prever": {
      "type": "models/predict",
      "type_version": 1,
      "label": "Prever",
      "params": {},
      "seed": 245060484
    },
    "forest_avaliar": {
      "type": "models/evaluate",
      "type_version": 2,
      "label": "Avaliar previsões",
      "params": {
        "resposta": "mpg"
      },
      "seed": 184601362
    },
    "svm": {
      "type": "ml/svm",
      "type_version": 1,
      "label": "SVM · vetores de suporte",
      "params": {
        "resposta": "mpg",
        "preditores": "wt, hp, disp"
      },
      "seed": 126600635
    },
    "svm_prever": {
      "type": "models/predict",
      "type_version": 1,
      "label": "Prever",
      "params": {},
      "seed": 78501791
    },
    "svm_avaliar": {
      "type": "models/evaluate",
      "type_version": 2,
      "label": "Avaliar previsões",
      "params": {
        "resposta": "mpg"
      },
      "seed": 33680127
    },
    "xgboost": {
      "type": "ml/xgboost",
      "type_version": 1,
      "label": "XGBoost",
      "params": {
        "resposta": "mpg",
        "preditores": "wt, hp, disp"
      },
      "seed": 34837424
    },
    "xgboost_prever": {
      "type": "models/predict",
      "type_version": 1,
      "label": "Prever",
      "params": {},
      "seed": 212360763
    },
    "xgboost_avaliar": {
      "type": "models/evaluate",
      "type_version": 2,
      "label": "Avaliar previsões",
      "params": {
        "resposta": "mpg"
      },
      "seed": 39339544
    }
  },
  "edges": [
    {
      "from": {
        "node": "dados",
        "port": "out"
      },
      "to": {
        "node": "divisao",
        "port": "dados"
      },
      "index": 1
    },
    {
      "from": {
        "node": "divisao",
        "port": "treino"
      },
      "to": {
        "node": "linear",
        "port": "dados"
      },
      "index": 1
    },
    {
      "from": {
        "node": "linear",
        "port": "out"
      },
      "to": {
        "node": "linear_prever",
        "port": "modelo"
      },
      "index": 1
    },
    {
      "from": {
        "node": "divisao",
        "port": "teste"
      },
      "to": {
        "node": "linear_prever",
        "port": "dados"
      },
      "index": 1
    },
    {
      "from": {
        "node": "linear_prever",
        "port": "out"
      },
      "to": {
        "node": "linear_avaliar",
        "port": "dados"
      },
      "index": 1
    },
    {
      "from": {
        "node": "divisao",
        "port": "treino"
      },
      "to": {
        "node": "cart",
        "port": "dados"
      },
      "index": 1
    },
    {
      "from": {
        "node": "cart",
        "port": "out"
      },
      "to": {
        "node": "cart_prever",
        "port": "modelo"
      },
      "index": 1
    },
    {
      "from": {
        "node": "divisao",
        "port": "teste"
      },
      "to": {
        "node": "cart_prever",
        "port": "dados"
      },
      "index": 1
    },
    {
      "from": {
        "node": "cart_prever",
        "port": "out"
      },
      "to": {
        "node": "cart_avaliar",
        "port": "dados"
      },
      "index": 1
    },
    {
      "from": {
        "node": "divisao",
        "port": "treino"
      },
      "to": {
        "node": "figs",
        "port": "dados"
      },
      "index": 1
    },
    {
      "from": {
        "node": "figs",
        "port": "out"
      },
      "to": {
        "node": "figs_prever",
        "port": "modelo"
      },
      "index": 1
    },
    {
      "from": {
        "node": "divisao",
        "port": "teste"
      },
      "to": {
        "node": "figs_prever",
        "port": "dados"
      },
      "index": 1
    },
    {
      "from": {
        "node": "figs_prever",
        "port": "out"
      },
      "to": {
        "node": "figs_avaliar",
        "port": "dados"
      },
      "index": 1
    },
    {
      "from": {
        "node": "divisao",
        "port": "treino"
      },
      "to": {
        "node": "forest",
        "port": "dados"
      },
      "index": 1
    },
    {
      "from": {
        "node": "forest",
        "port": "out"
      },
      "to": {
        "node": "forest_prever",
        "port": "modelo"
      },
      "index": 1
    },
    {
      "from": {
        "node": "divisao",
        "port": "teste"
      },
      "to": {
        "node": "forest_prever",
        "port": "dados"
      },
      "index": 1
    },
    {
      "from": {
        "node": "forest_prever",
        "port": "out"
      },
      "to": {
        "node": "forest_avaliar",
        "port": "dados"
      },
      "index": 1
    },
    {
      "from": {
        "node": "divisao",
        "port": "treino"
      },
      "to": {
        "node": "svm",
        "port": "dados"
      },
      "index": 1
    },
    {
      "from": {
        "node": "svm",
        "port": "out"
      },
      "to": {
        "node": "svm_prever",
        "port": "modelo"
      },
      "index": 1
    },
    {
      "from": {
        "node": "divisao",
        "port": "teste"
      },
      "to": {
        "node": "svm_prever",
        "port": "dados"
      },
      "index": 1
    },
    {
      "from": {
        "node": "svm_prever",
        "port": "out"
      },
      "to": {
        "node": "svm_avaliar",
        "port": "dados"
      },
      "index": 1
    },
    {
      "from": {
        "node": "divisao",
        "port": "treino"
      },
      "to": {
        "node": "xgboost",
        "port": "dados"
      },
      "index": 1
    },
    {
      "from": {
        "node": "xgboost",
        "port": "out"
      },
      "to": {
        "node": "xgboost_prever",
        "port": "modelo"
      },
      "index": 1
    },
    {
      "from": {
        "node": "divisao",
        "port": "teste"
      },
      "to": {
        "node": "xgboost_prever",
        "port": "dados"
      },
      "index": 1
    },
    {
      "from": {
        "node": "xgboost_prever",
        "port": "out"
      },
      "to": {
        "node": "xgboost_avaliar",
        "port": "dados"
      },
      "index": 1
    }
  ],
  "ui": {
    "positions": {
      "dados": [0, 300],
      "divisao": [320, 300],
      "linear": [680, 0],
      "linear_prever": [1040, 0],
      "linear_avaliar": [1400, 0],
      "cart": [680, 320],
      "cart_prever": [1040, 320],
      "cart_avaliar": [1400, 320],
      "figs": [680, 640],
      "figs_prever": [1040, 640],
      "figs_avaliar": [1400, 640],
      "forest": [680, 960],
      "forest_prever": [1040, 960],
      "forest_avaliar": [1400, 960],
      "svm": [680, 1280],
      "svm_prever": [1040, 1280],
      "svm_avaliar": [1400, 1280],
      "xgboost": [680, 1600],
      "xgboost_prever": [1040, 1600],
      "xgboost_avaliar": [1400, 1600]
    },
    "sizes": {},
    "views": {},
    "frames": {},
    "modes": {},
    "notes": {}
  }
}
